{"schema_version": "crypto_perp_outcome.v1", "artifact_id": "a755d7350b76e21a316edca7efab791f1025ad85b3f5b76e22e551008b7eea75", "created_at": "2026-06-21T13:28:00Z", "producer": {"tool": "sis", "command": "crypto-perp-watchdeck"}, "source_refs": [], "boundary": {"permits_live_order": false, "live_conversion_allowed": false, "wallet_used": false, "signing_used": false, "exchange_write_used": false, "live_order_submitted": false}, "outcome_id": "e6b142fc68cf23443b8f6c296c0e1d423b061be589bb7b97d647d208d66e8c91", "event_id": "event-varied-04", "settled_at": "2026-06-21T13:28:00Z", "horizons": [{"horizon_minutes": 64, "matured": true, "reference_price": "104", "close_price": "104.416", "raw_return": "0.004", "short_return_before_cost": "-0.004", "long_return_before_cost": "0.004", "mfe_long": "0.01906", "mae_long": "-0.015", "mfe_short": "0.015", "mae_short": "-0.01906", "high_first_low_first": "HIGH_FIRST", "market_adjusted_return": "0.004"}], "near_miss_refs": [], "known_gaps": ["DOGFOOD_VARIED_REGIME_PROXY_SLOW_PUMP_74H_V1"]}