{"schema_version": "crypto_perp_outcome.v1", "artifact_id": "3d938b00b348b2c79b5bdb55a05f4c51c93cb80025eb013c724fc5b1ce5d8a6a", "created_at": "2026-06-21T10:21:00Z", "producer": {"tool": "sis", "command": "crypto-perp-watchdeck"}, "source_refs": [], "boundary": {"permits_live_order": false, "live_conversion_allowed": false, "wallet_used": false, "signing_used": false, "exchange_write_used": false, "live_order_submitted": false}, "outcome_id": "cada1c3ac1c14c9d9eb7e248cc79f15ad58519d6593d384f7d1d6ff18a49b21e", "event_id": "event-varied-03", "settled_at": "2026-06-21T10:21:00Z", "horizons": [{"horizon_minutes": 63, "matured": true, "reference_price": "103", "close_price": "94.76", "raw_return": "-0.08", "short_return_before_cost": "0.08", "long_return_before_cost": "-0.08", "mfe_long": "0.015", "mae_long": "-0.0938", "mfe_short": "0.0938", "mae_short": "-0.015", "high_first_low_first": "LOW_FIRST", "market_adjusted_return": "-0.065"}], "near_miss_refs": [], "known_gaps": ["DOGFOOD_VARIED_REGIME_PROXY_MARKET_WINDOW_V1"]}